,Ticker,Name,Exchange,output
1577,KIM-H,Kimco Realty Corporation Deposi,NYSE,Kimco Realty Corporation Deposi (KIM-H)
1578,KIM-I,Kimco Realty Corporation Deposi,NYSE,Kimco Realty Corporation Deposi (KIM-I)
1579,KIM-J,Kimco Realty Corporation Class,NYSE,Kimco Realty Corporation Class (KIM-J)
1580,KIM-K,Kimco Realty Corporation Class,NYSE,Kimco Realty Corporation Class (KIM-K)
1581,KIO,Kkr Income Opportunities Fund,NYSE,Kkr Income Opportunities Fund (KIO)
1582,KKD,Krispy Kreme Doughnuts,NYSE,Krispy Kreme Doughnuts (KKD)
1583,KKR,Kkr,NYSE,Kkr (KKR)
1584,KMB,Kimberly-Clark Corp.,NYSE,Kimberly-Clark Corp. (KMB)
1585,KMF,Kayne Anderson Midstream Energy Fund,NYSE,Kayne Anderson Midstream Energy Fund (KMF)
1586,KMG,Kmg Chemicals,NYSE,Kmg Chemicals (KMG)
1587,KMI,Kinder Morgan,NYSE,Kinder Morgan (KMI)
1588,KMI.W,Kinder Morgan Inc. W/I,NYSE,Kinder Morgan Inc. W/I (KMI.W)
1589,KMM,Scudder Multi-Market Income Trust,NYSE,Scudder Multi-Market Income Trust (KMM)
1590,KMP,Kinder Morgan Energy Partners L.P.,NYSE,Kinder Morgan Energy Partners L.P. (KMP)
1591,KMPR,Unitrin,NYSE,Unitrin (KMPR)
1592,KMR,Kinder Morgan Management Llc,NYSE,Kinder Morgan Management Llc (KMR)
1593,KMT,Kennametal Inc.,NYSE,Kennametal Inc. (KMT)
1594,KMX,Carmax Inc,NYSE,Carmax Inc (KMX)
1595,KND,Kindred Healthcare,NYSE,Kindred Healthcare (KND)
1596,KNL,Knoll,NYSE,Knoll (KNL)
1597,KNM,Konami Corp.,NYSE,Konami Corp. (KNM)
1598,KNOP,Knot Offshore Partners Lp Commo,NYSE,Knot Offshore Partners Lp Commo (KNOP)
1599,KNX,Knight Transportation,NYSE,Knight Transportation (KNX)
1600,KO,Coca-Cola Company,NYSE,Coca-Cola Company (KO)
1601,KOF,Coca Cola Femsa S.A.B. De C.V.,NYSE,Coca Cola Femsa S.A.B. De C.V. (KOF)
1602,KOG,Kodiak Oil,NYSE,Kodiak Oil (KOG)
1603,KOP,Koppers Holdings Inc.,NYSE,Koppers Holdings Inc. (KOP)
1604,KORS,Michael Kors Holdings Limited,NYSE,Michael Kors Holdings Limited (KORS)
1605,KOS,Kosmos Energy Ltd.,NYSE,Kosmos Energy Ltd. (KOS)
1606,KR,Kroger Company,NYSE,Kroger Company (KR)
1607,KRA,Kraton Performance Polymers Inc,NYSE,Kraton Performance Polymers Inc (KRA)
1608,KRC,Kilroy Realty Corp.,NYSE,Kilroy Realty Corp. (KRC)
1609,KRC-G,Kilroy Realty Corporation,NYSE,Kilroy Realty Corporation (KRC-G)
1610,KRC-H,Kilroy Realty Corporation,NYSE,Kilroy Realty Corporation (KRC-H)
1611,KRG,Kite Realty Group Trust,NYSE,Kite Realty Group Trust (KRG)
1612,KRG-A,Kite Realty Group Trust,NYSE,Kite Realty Group Trust (KRG-A)
1613,KRO,Kronos Worldwide Inc,NYSE,Kronos Worldwide Inc (KRO)
1614,KS,Kapstone Paper And Packaging Corp.,NYSE,Kapstone Paper And Packaging Corp. (KS)
1615,KSM,Scudder Strategic Municiple Income Trust,NYSE,Scudder Strategic Municiple Income Trust (KSM)
1616,KSS,Kohl's Corp.,NYSE,Kohl's Corp. (KSS)
1617,KST,Scudder Strategic Income Trust,NYSE,Scudder Strategic Income Trust (KST)
1618,KSU,Kansas City Southern,NYSE,Kansas City Southern (KSU)
1619,KSU.P,Kansas Cty Sthn 4%,NYSE,Kansas Cty Sthn 4% (KSU.P)
1620,KT,Korea Telecom Corp.,NYSE,Korea Telecom Corp. (KT)
1621,KTF,Scudder Municiple Income Trust,NYSE,Scudder Municiple Income Trust (KTF)
1622,KTH,Lehman Abs Corp.,NYSE,Lehman Abs Corp. (KTH)
1623,KTN,Lehman Abs Corp.,NYSE,Lehman Abs Corp. (KTN)
1624,KTP,Lehman Abs Corp.,NYSE,Lehman Abs Corp. (KTP)
1625,KW,Kennedy-Wilson Holdings Inc.,NYSE,Kennedy-Wilson Holdings Inc. (KW)
1626,KWK,Quicksilver Resources Inc.,NYSE,Quicksilver Resources Inc. (KWK)
1627,KWN,Kennedy-Wilson Holdings Inc.,NYSE,Kennedy-Wilson Holdings Inc. (KWN)
1628,KWR,Quaker Chemical Corp.,NYSE,Quaker Chemical Corp. (KWR)
1629,KYE,Kayne Anderson Energy Total Return Fund,NYSE,Kayne Anderson Energy Total Return Fund (KYE)
1630,KYN,Kayne Anderson MLP Investment Company,NYSE,Kayne Anderson MLP Investment Company (KYN)
1631,KYN-E,Kayne Anderson MLP Investment,NYSE,Kayne Anderson MLP Investment (KYN-E)
1632,KYN-F,Kayne Anderson MLP Investment,NYSE,Kayne Anderson MLP Investment (KYN-F)
1633,KYO,Kyocera Corp.,NYSE,Kyocera Corp. (KYO)
1634,L,Loews Corp.,NYSE,Loews Corp. (L)
1635,LAD,Lithia Motors,NYSE,Lithia Motors (LAD)
1636,LAS,Lentuo International Inc.,NYSE,Lentuo International Inc. (LAS)
1637,LAZ,Lazard Ltd,NYSE,Lazard Ltd (LAZ)
1638,LBF,Scudder Global High,NYSE,Scudder Global High (LBF)
1639,LCC,US Airways Group Inc. New,NYSE,US Airways Group Inc. New (LCC)
1640,LCM,Advent/Claymore Enhanced Growth &,NYSE,Advent/Claymore Enhanced Growth & (LCM)
1641,LDF,Latin American Discovery Fund,NYSE,Latin American Discovery Fund (LDF)
1642,LDK,Ldk Solar Co. Ltd,NYSE,Ldk Solar Co. Ltd (LDK)
1643,LDL,Lydall,NYSE,Lydall (LDL)
1644,LDP,Cohen & Steers Limited Duration,NYSE,Cohen & Steers Limited Duration (LDP)
1645,LDR,Landauer,NYSE,Landauer (LDR)
1646,LEA,Lear Corp.,NYSE,Lear Corp. (LEA)
1647,LEE,Lee Enterprises Inc.,NYSE,Lee Enterprises Inc. (LEE)
1648,LEG,Leggett & Platt Inc.,NYSE,Leggett & Platt Inc. (LEG)
1649,LEN,Lennar Corp.,NYSE,Lennar Corp. (LEN)
1650,LEN.B,Lennar Corp.,NYSE,Lennar Corp. (LEN.B)
1651,LEO,Dreyfus Strategic Municipals,NYSE,Dreyfus Strategic Municipals (LEO)
1652,LF,Leapfrog Enterprises Inc,NYSE,Leapfrog Enterprises Inc (LF)
1653,LFC,China Life Insurance Company Limited,NYSE,China Life Insurance Company Limited (LFC)
1654,LFL,Latam Airlines Group Sa,NYSE,Latam Airlines Group Sa (LFL)
1655,LG,Laclede Group,NYSE,Laclede Group (LG)
1656,LGF,Lions Gate Entertainment Corp.,NYSE,Lions Gate Entertainment Corp. (LGF)
1657,LGI,Lazard Global Total Return And,NYSE,Lazard Global Total Return And (LGI)
1658,LGP,Lehigh Gas Partners Lp,NYSE,Lehigh Gas Partners Lp (LGP)
1659,LH,Laboratory Corporation Of America,NYSE,Laboratory Corporation Of America (LH)
1660,LHO,Lasalle Hotel Properties,NYSE,Lasalle Hotel Properties (LHO)
1661,LHO-G,Lasalle Hotel Proper,NYSE,Lasalle Hotel Proper (LHO-G)
1662,LHO-H,Lasalle Hotl 8.375 B,NYSE,Lasalle Hotl 8.375 B (LHO-H)
1663,LHO-I,Lasalle Hotel Properties,NYSE,Lasalle Hotel Properties (LHO-I)
1664,LII,Lennox International,NYSE,Lennox International (LII)
1665,LIN,Lin Media Llc,NYSE,Lin Media Llc (LIN)
1666,LITB,Lightinthebox Holding Co. Ltd,NYSE,Lightinthebox Holding Co. Ltd (LITB)
1667,LL,Lumber Liquidators Holdings Inc,NYSE,Lumber Liquidators Holdings Inc (LL)
1668,LLL,L-3 Communications Holdings,NYSE,L-3 Communications Holdings (LLL)
1669,LLY,Eli Lilly And Company,NYSE,Eli Lilly And Company (LLY)
1670,LM,Legg Mason,NYSE,Legg Mason (LM)
1671,LMT,Lockheed Martin Corp.,NYSE,Lockheed Martin Corp. (LMT)
1672,LNC,Lincoln National Corp.,NYSE,Lincoln National Corp. (LNC)
1673,LNC.W,Lincoln National Corp,NYSE,Lincoln National Corp (LNC.W)
1674,LND,Brasilagro Brazi ADR,NYSE,Brasilagro Brazi ADR (LND)
1675,LNKD,Linkedin,NYSE,Linkedin (LNKD)
1676,LNN,Lindsay Corp.,NYSE,Lindsay Corp. (LNN)
1677,LNT,Alliant Energy Corp.,NYSE,Alliant Energy Corp. (LNT)
1678,LO,Lorillard Inc,NYSE,Lorillard Inc (LO)
1679,LOCK,Lifelock Inc.,NYSE,Lifelock Inc. (LOCK)
1680,LOR,Lazard World Dividend &,NYSE,Lazard World Dividend & (LOR)
1681,LOW,Lowe's Companies,NYSE,Lowe's Companies (LOW)
1682,LPI,Laredo Petroleum Holdings Inc,NYSE,Laredo Petroleum Holdings Inc (LPI)
1683,LPL,Lg Display Co. Limited American,NYSE,Lg Display Co. Limited American (LPL)
1684,LPR,Lone Pine Resources Inc.,NYSE,Lone Pine Resources Inc. (LPR)
1685,LPS,Lender Processing Services Inc,NYSE,Lender Processing Services Inc (LPS)
1686,LPX,Louisiana-Pacific Corp.,NYSE,Louisiana-Pacific Corp. (LPX)
1687,LRE,Lrr Energy L.P.,NYSE,Lrr Energy L.P. (LRE)
1688,LRN,K12 Inc,NYSE,K12 Inc (LRN)
1689,LRY,Liberty Property Trust,NYSE,Liberty Property Trust (LRY)
1690,LSE,Caplease Funding Inc,NYSE,Caplease Funding Inc (LSE)
1691,LSE-A,Caplease Fndg Ser A,NYSE,Caplease Fndg Ser A (LSE-A)
1692,LSE-B,Caplease Inc. 8.375% Series B,NYSE,Caplease Inc. 8.375% Series B (LSE-B)
1693,LSE-C,Caplease Inc.,NYSE,Caplease Inc. (LSE-C)
1694,LTC,Ltc Properties,NYSE,Ltc Properties (LTC)
1695,LTD,L Brands Inc,NYSE,L Brands Inc (LTD)
1696,LTM,Life Time Fitness,NYSE,Life Time Fitness (LTM)
1697,LUB,Luby's,NYSE,Luby's (LUB)
1698,LUK,Leucadia National Corp.,NYSE,Leucadia National Corp. (LUK)
1699,LUV,Southwest Airlines Company,NYSE,Southwest Airlines Company (LUV)
1700,LUX,Luxottica Group S.P.A.,NYSE,Luxottica Group S.P.A. (LUX)
1701,LVB,Steinway Musical Instruments,NYSE,Steinway Musical Instruments (LVB)
1702,LVLT,Level 3 Communications,NYSE,Level 3 Communications (LVLT)
1703,LVS,Las Vegas Sands,NYSE,Las Vegas Sands (LVS)
1704,LXFR,Luxfer Holdings Plc,NYSE,Luxfer Holdings Plc (LXFR)
1705,LXFT,Luxoft Holding Inc.,NYSE,Luxoft Holding Inc. (LXFT)
1706,LXK,Lexmark International,NYSE,Lexmark International (LXK)
1707,LXP,Lexington Realty Trust,NYSE,Lexington Realty Trust (LXP)
1708,LXP-C,Lexington Realty Tru,NYSE,Lexington Realty Tru (LXP-C)
1709,LXU,Lsb Industries Inc.,NYSE,Lsb Industries Inc. (LXU)
1710,LYB,Lyondellbasell Industries Nv,NYSE,Lyondellbasell Industries Nv (LYB)
1711,LYG,Lloyds Banking Group Plc,NYSE,Lloyds Banking Group Plc (LYG)
1712,LYG-A,Lloyds Banking Group Plc,NYSE,Lloyds Banking Group Plc (LYG-A)
1713,LYV,Live Nation Entertainment,NYSE,Live Nation Entertainment (LYV)
1714,LZB,La-Z-Boy Inc.,NYSE,La-Z-Boy Inc. (LZB)
1715,M,Macy's Inc,NYSE,Macy's Inc (M)
1716,MA,Mastercard Inc.,NYSE,Mastercard Inc. (MA)
1717,MAA,Mid-America Apartment Communities,NYSE,Mid-America Apartment Communities (MAA)
1718,MAC,Macerich Company,NYSE,Macerich Company (MAC)
1719,MAIN,Main Street Capital Corp.,NYSE,Main Street Capital Corp. (MAIN)
1720,MAN,Manpower Inc,NYSE,Manpower Inc (MAN)
1721,MANU,Manchester United Ltd.,NYSE,Manchester United Ltd. (MANU)
1722,MAR,Marriot International,NYSE,Marriot International (MAR)
1723,MAS,Masco Corp.,NYSE,Masco Corp. (MAS)
1724,MATX,Matson Inc,NYSE,Matson Inc (MATX)
1725,MAV,Pioneer Muni High Income Advantage Trust,NYSE,Pioneer Muni High Income Advantage Trust (MAV)
1726,MBI,Mbia,NYSE,Mbia (MBI)
1727,MBT,Mobile Telesystems,NYSE,Mobile Telesystems (MBT)
1728,MCA,Blackrock Muniyield California Insured,NYSE,Blackrock Muniyield California Insured (MCA)
1729,MCC,Medley Capital Corp.,NYSE,Medley Capital Corp. (MCC)
1730,MCD,Mcdonald's Corp.,NYSE,Mcdonald's Corp. (MCD)
1731,MCI,Massmutual Corporate Investors,NYSE,Massmutual Corporate Investors (MCI)
1732,MCK,Mckesson Corp.,NYSE,Mckesson Corp. (MCK)
1733,MCN,Madison/Claymore Covered Call & Equity,NYSE,Madison/Claymore Covered Call & Equity (MCN)
1734,MCO,Moody's Corp.,NYSE,Moody's Corp. (MCO)
1735,MCP,Molycorp Inc,NYSE,Molycorp Inc (MCP)
1736,MCP-A,Molycorp Inc Pfd Conv Ser A,NYSE,Molycorp Inc Pfd Conv Ser A (MCP-A)
1737,MCQ,Medley Capital Corporation 7.12,NYSE,Medley Capital Corporation 7.12 (MCQ)
1738,MCR,Mfs Charter Income Trust,NYSE,Mfs Charter Income Trust (MCR)
1739,MCS,Marcus Corp.,NYSE,Marcus Corp. (MCS)
1740,MCV,Medley Capital Corporation,NYSE,Medley Capital Corporation (MCV)
1741,MCY,Mercury General Corp.,NYSE,Mercury General Corp. (MCY)
1742,MD,Mednax Inc,NYSE,Mednax Inc (MD)
1743,MDC,M.D.C. Holdings,NYSE,M.D.C. Holdings (MDC)
1744,MDP,Meredith Corp.,NYSE,Meredith Corp. (MDP)
1745,MDR,Mcdermott International,NYSE,Mcdermott International (MDR)
1746,MDT,Medtronic,NYSE,Medtronic (MDT)
1747,MDU,Mdu Res Group Inc,NYSE,Mdu Res Group Inc (MDU)
1748,MED,Medifast Inc,NYSE,Medifast Inc (MED)
1749,MEG,Media General,NYSE,Media General (MEG)
1750,MEI,Methode Electronics,NYSE,Methode Electronics (MEI)
1751,MEN,Blackrock Munienhanced Fund,NYSE,Blackrock Munienhanced Fund (MEN)
1752,MER-D,Merrill Lyn 7.0 Topr,NYSE,Merrill Lyn 7.0 Topr (MER-D)
1753,MER-E,M L Cap TR 7.12,NYSE,M L Cap TR 7.12 (MER-E)
1754,MER-F,Merrill Ly Cap V7.28,NYSE,Merrill Ly Cap V7.28 (MER-F)
1755,MER-K,Ml 6.45% Trust Pfd,NYSE,Ml 6.45% Trust Pfd (MER-K)
1756,MER-M,Ml Cap TR II 6.45% P,NYSE,Ml Cap TR II 6.45% P (MER-M)
1757,MER-P,Ml Cap TR III 7.375%,NYSE,Ml Cap TR III 7.375% (MER-P)
1758,MET,Metlife,NYSE,Metlife (MET)
1759,MET-A,Metlife Pfd A Fltg,NYSE,Metlife Pfd A Fltg (MET-A)
1760,MET-B,Metlife Inc Pfd B,NYSE,Metlife Inc Pfd B (MET-B)
1761,MFA,Mfa Financial Inc,NYSE,Mfa Financial Inc (MFA)
1762,MFA-B,Mfa Financial Inc,NYSE,Mfa Financial Inc (MFA-B)
1763,MFB,Maidenform Brands,NYSE,Maidenform Brands (MFB)
1764,MFC,Manulife Financial Corp,NYSE,Manulife Financial Corp (MFC)
1765,MFD,Macquarie/First Trust Global,NYSE,Macquarie/First Trust Global (MFD)
1766,MFG,Mizuho Financial Group,NYSE,Mizuho Financial Group (MFG)
1767,MFL,Blackrock Muniholdings Investment,NYSE,Blackrock Muniholdings Investment (MFL)
1768,MFM,Mfs Muni Income Trust,NYSE,Mfs Muni Income Trust (MFM)
1769,MFO,Mfa Financial Inc.,NYSE,Mfa Financial Inc. (MFO)
1770,MFT,Blackrock Muniyield Investment,NYSE,Blackrock Muniyield Investment (MFT)
1771,MFV,Mfs Special Value Trust,NYSE,Mfs Special Value Trust (MFV)
1772,MG,Mistras Group Inc,NYSE,Mistras Group Inc (MG)
1773,MGA,Magna International,NYSE,Magna International (MGA)
1774,MGF,Mfs Government Markets Income Trust,NYSE,Mfs Government Markets Income Trust (MGF)
1775,MGM,Mgm Resorts International,NYSE,Mgm Resorts International (MGM)
1776,MGR,Affiliated Managers Group Inc,NYSE,Affiliated Managers Group Inc (MGR)
1777,MGU,Macquarie Global Infrastructure Total,NYSE,Macquarie Global Infrastructure Total (MGU)
1778,MH-A,Maiden Holdings Ltd. 8.25%,NYSE,Maiden Holdings Ltd. 8.25% (MH-A)
1779,MHD,Blackrock Muniholdings Fund,NYSE,Blackrock Muniholdings Fund (MHD)
1780,MHF,Western Asset Muni High,NYSE,Western Asset Muni High (MHF)
1781,MHFI,The Mcgraw-Hill Companies Inc.,NYSE,The Mcgraw-Hill Companies Inc. (MHFI)
1782,MHI,Pioneer Muni High Income Trust,NYSE,Pioneer Muni High Income Trust (MHI)
1783,MHK,Mohawk Industries,NYSE,Mohawk Industries (MHK)
1784,MHN,Blackrock Muniholdings New York Quality,NYSE,Blackrock Muniholdings New York Quality (MHN)
1785,MHNA,Maiden Holdings North America,NYSE,Maiden Holdings North America (MHNA)
1786,MHNB,Maiden Holdings North America,NYSE,Maiden Holdings North America (MHNB)
1787,MHO,M/I Homes,NYSE,M/I Homes (MHO)
1788,MHO-A,M/I Homes Sr A Pf Ds,NYSE,M/I Homes Sr A Pf Ds (MHO-A)
1789,MHR,Magnum Hunter Resources Corp.,NYSE,Magnum Hunter Resources Corp. (MHR)
1790,MHY,Western Asset Managed High,NYSE,Western Asset Managed High (MHY)
1791,MIC,Macquarie Infrastructure Company Trust,NYSE,Macquarie Infrastructure Company Trust (MIC)
1792,MIE,Cohen & Steers MLP Income And,NYSE,Cohen & Steers MLP Income And (MIE)
1793,MIG,Meadowbrook Insurance Group,NYSE,Meadowbrook Insurance Group (MIG)
1794,MIL,Mfc Industrial Ltd,NYSE,Mfc Industrial Ltd (MIL)
1795,MILL,Miller Petroleum,NYSE,Miller Petroleum (MILL)
1796,MIN,Mfs Intermediate Income Trust,NYSE,Mfs Intermediate Income Trust (MIN)
1797,MIT-A,Ag Mortgage Investment Trust,NYSE,Ag Mortgage Investment Trust (MIT-A)
1798,MITT,Ag Mortgage Investment Trust,NYSE,Ag Mortgage Investment Trust (MITT)
1799,MIXT,Mix Telematics Limited,NYSE,Mix Telematics Limited (MIXT)
1800,MIY,Blackrock Muniyield Michigan Quality,NYSE,Blackrock Muniyield Michigan Quality (MIY)
1801,MJI,Blackrock Muniyield New Jersey Quality,NYSE,Blackrock Muniyield New Jersey Quality (MJI)
1802,MJN,Mead Johnson Nutrition Company,NYSE,Mead Johnson Nutrition Company (MJN)
1803,MKC,Mccormick & Company Inc.,NYSE,Mccormick & Company Inc. (MKC)
1804,MKC.V,Mccormick & Company Inc.,NYSE,Mccormick & Company Inc. (MKC.V)
1805,MKL,Markel Corp.,NYSE,Markel Corp. (MKL)
1806,MLG,Metlife,NYSE,Metlife (MLG)
1807,MLI,Mueller Industries,NYSE,Mueller Industries (MLI)
1808,MLM,Martin Marietta Materials,NYSE,Martin Marietta Materials (MLM)
1809,MLP,Maui Land & Pineapple Company,NYSE,Maui Land & Pineapple Company (MLP)
1810,MLR,Miller Industries,NYSE,Miller Industries (MLR)
1811,MLU,Metlife Inc.,NYSE,Metlife Inc. (MLU)
1812,MM,Millennial Media Inc.,NYSE,Millennial Media Inc. (MM)
1813,MMC,Marsh & Mclennan Companies,NYSE,Marsh & Mclennan Companies (MMC)
1814,MMD,Mainstay Defined Muni Opp Fund,NYSE,Mainstay Defined Muni Opp Fund (MMD)
1815,MMM,3M Company,NYSE,3M Company (MMM)
1816,MMP,Magellan Midstream Partners L.P.,NYSE,Magellan Midstream Partners L.P. (MMP)
1817,MMS,Maximus,NYSE,Maximus (MMS)
1818,MMT,Mfs Multimarket Income Trust,NYSE,Mfs Multimarket Income Trust (MMT)
1819,MMU,Western Asset Managed Municipals Fund,NYSE,Western Asset Managed Municipals Fund (MMU)
1820,MN,Manning & Napier Inc.,NYSE,Manning & Napier Inc. (MN)
1821,MNE,Blackrock Muni New York Intermediate,NYSE,Blackrock Muni New York Intermediate (MNE)
1822,MNI,Mcclatchy Company,NYSE,Mcclatchy Company (MNI)
1823,MNK,Mallinckrodt Plc Ordinary Share,NYSE,Mallinckrodt Plc Ordinary Share (MNK)
1824,MNP,Western Asset Muni Partners Fund,NYSE,Western Asset Muni Partners Fund (MNP)
1825,MNR,Monmouth Real Estate Investment Corp.,NYSE,Monmouth Real Estate Investment Corp. (MNR)
1826,MNR-A,Monmouth Real Estate Inv,NYSE,Monmouth Real Estate Inv (MNR-A)
1827,MNR-B,Monmouth Real Estate Investmen,NYSE,Monmouth Real Estate Investmen (MNR-B)
1828,MO,Altria Group,NYSE,Altria Group (MO)
1829,MOD,Modine Manufacturing Company,NYSE,Modine Manufacturing Company (MOD)
1830,MODN,Model N Inc. Common Stock,NYSE,Model N Inc. Common Stock (MODN)
1831,MOG.A,Moog Inc.,NYSE,Moog Inc. (MOG.A)
1832,MOG.B,Moog Inc.,NYSE,Moog Inc. (MOG.B)
1833,MOH,Molina Healthcare Inc,NYSE,Molina Healthcare Inc (MOH)
1834,MON,Monsanto Company,NYSE,Monsanto Company (MON)
1835,MOS,Mosaic Company,NYSE,Mosaic Company (MOS)
1836,MOV,Movado Group Inc.,NYSE,Movado Group Inc. (MOV)
1837,MP-D,Mississippi Pr 5.25,NYSE,Mississippi Pr 5.25 (MP-D)
1838,MPA,Blackrock Muniyield Pennsylvania Quality,NYSE,Blackrock Muniyield Pennsylvania Quality (MPA)
1839,MPC,Marathon Petroleum Corporation,NYSE,Marathon Petroleum Corporation (MPC)
1840,MPG,Mpg Office Trust,NYSE,Mpg Office Trust (MPG)
1841,MPG-A,Maguire Pptys Pfd A,NYSE,Maguire Pptys Pfd A (MPG-A)
1842,MPLX,Mplx Lp,NYSE,Mplx Lp (MPLX)
1843,MPO,Midstates Petroleum Company I,NYSE,Midstates Petroleum Company I (MPO)
1844,MPR,Met-Pro Corp.,NYSE,Met-Pro Corp. (MPR)
1845,MPV,Massmutual Participation Investors,NYSE,Massmutual Participation Investors (MPV)
1846,MPW,Medical Properties Trust,NYSE,Medical Properties Trust (MPW)
1847,MPX,Marine Products Corp.,NYSE,Marine Products Corp. (MPX)
1848,MQT,Blackrock Muniyield Quality Fund II,NYSE,Blackrock Muniyield Quality Fund II (MQT)
1849,MQY,Blackrock Muniyield Quality Fund,NYSE,Blackrock Muniyield Quality Fund (MQY)
1850,MR,Mindray Medical International Limited,NYSE,Mindray Medical International Limited (MR)
1851,MRC,Mrc Global Inc.,NYSE,Mrc Global Inc. (MRC)
1852,MRF,American,NYSE,American (MRF)
1853,MRH,Montpelier Re Holdings Ltd,NYSE,Montpelier Re Holdings Ltd (MRH)
1854,MRH-A,Montpelier Re Holdings Ltd,NYSE,Montpelier Re Holdings Ltd (MRH-A)
1855,MRIN,Marin Sotfware Incorporated,NYSE,Marin Sotfware Incorporated (MRIN)
1856,MRK,Merck & Company,NYSE,Merck & Company (MRK)
1857,MRO,Marathon Oil Corp.,NYSE,Marathon Oil Corp. (MRO)
1858,MS,Morgan Stanley,NYSE,Morgan Stanley (MS)
1859,MS-A,Morgan Stanley Prfd 'A',NYSE,Morgan Stanley Prfd 'A' (MS-A)
1860,MSA,Mine Safety Appliances Company,NYSE,Mine Safety Appliances Company (MSA)
1861,MSB,Mesabi Trust,NYSE,Mesabi Trust (MSB)
1862,MSCA,Main Street Capital Corporatio,NYSE,Main Street Capital Corporatio (MSCA)
1863,MSCI,MSCI Inc,NYSE,MSCI Inc (MSCI)
1864,MSD,Morgan Stanley Emerging Markets Debt,NYSE,Morgan Stanley Emerging Markets Debt (MSD)
1865,MSF,Morgan Stanley Emerging Markets Fund Inc,NYSE,Morgan Stanley Emerging Markets Fund Inc (MSF)
1866,MSI,Motorola Solutions,NYSE,Motorola Solutions (MSI)
1867,MSJ,Morgan Stanley Cap Trust Vi Cap,NYSE,Morgan Stanley Cap Trust Vi Cap (MSJ)
1868,MSK,Morgan Stanley Cap TR ViII Gdt Cap,NYSE,Morgan Stanley Cap TR ViII Gdt Cap (MSK)
1869,MSM,Msc Industrial Direct Company,NYSE,Msc Industrial Direct Company (MSM)
1870,MSO,Martha Stewart Living Omnimedia,NYSE,Martha Stewart Living Omnimedia (MSO)
1871,MSP,Madison Strategic Sector Premium Fund,NYSE,Madison Strategic Sector Premium Fund (MSP)
1872,MSZ,Morgan Stanley Capital Trust Vii Cap,NYSE,Morgan Stanley Capital Trust Vii Cap (MSZ)
1873,MT,Arcelormittal,NYSE,Arcelormittal (MT)
1874,MTB,M&T Bank Corp.,NYSE,M&T Bank Corp. (MTB)
1875,MTB-A,M&T Cap TR Pfd,NYSE,M&T Cap TR Pfd (MTB-A)
1876,MTB-C,M&T Bank Corporation Fixed Rate,NYSE,M&T Bank Corporation Fixed Rate (MTB-C)
1877,MTB.P,M&T Bank Corporation Fixed Rate,NYSE,M&T Bank Corporation Fixed Rate (MTB.P)
1878,MTB.W,M&T Bank Corporation Warrants,NYSE,M&T Bank Corporation Warrants (MTB.W)
1879,MTCN,Arcelormittal,NYSE,Arcelormittal (MTCN)
1880,MTD,Mettler-Toledo International,NYSE,Mettler-Toledo International (MTD)
1881,MTDR,Matador Resources Company,NYSE,Matador Resources Company (MTDR)
1882,MTG,Mgic Investment Corp.,NYSE,Mgic Investment Corp. (MTG)
1883,MTH,Meritage Corp.,NYSE,Meritage Corp. (MTH)
1884,MTL,Mechel Steel Group Oao,NYSE,Mechel Steel Group Oao (MTL)
1885,MTL.P,Mechel Steel Group Oao American,NYSE,Mechel Steel Group Oao American (MTL.P)
1886,MTN,Vail Resorts,NYSE,Vail Resorts (MTN)
1887,MTOR,Arvinmeritor,NYSE,Arvinmeritor (MTOR)
1888,MTR,Mesa Royalty Trust,NYSE,Mesa Royalty Trust (MTR)
1889,MTRN,Brush Wellman Inc,NYSE,Brush Wellman Inc (MTRN)
1890,MTS,Montgomery Street Income Securities,NYSE,Montgomery Street Income Securities (MTS)
1891,MTT,Western Asset Muni Defined Opportunity,NYSE,Western Asset Muni Defined Opportunity (MTT)
1892,MTU,Mitsubishi Ufj Financial Group Inc,NYSE,Mitsubishi Ufj Financial Group Inc (MTU)
1893,MTW,Manitowoc Company,NYSE,Manitowoc Company (MTW)
1894,MTX,Minerals Technologies Inc.,NYSE,Minerals Technologies Inc. (MTX)
1895,MTZ,Mastec,NYSE,Mastec (MTZ)
1896,MUA,Blackrock Muniassets Fund,NYSE,Blackrock Muniassets Fund (MUA)
1897,MUC,Blackrock Muniholdings California,NYSE,Blackrock Muniholdings California (MUC)
1898,MUE,Blackrock Muniholdings Quality Fund II,NYSE,Blackrock Muniholdings Quality Fund II (MUE)
1899,MUH,Blackrock Muniholdings Fund II,NYSE,Blackrock Muniholdings Fund II (MUH)
1900,MUI,Blackrock Muni Intermediate Duration,NYSE,Blackrock Muni Intermediate Duration (MUI)
1901,MUJ,Blackrock Muniholdings New Jersey,NYSE,Blackrock Muniholdings New Jersey (MUJ)
1902,MUR,Murphy Oil Corp.,NYSE,Murphy Oil Corp. (MUR)
1903,MUS,Blackrock Muniholdings Quality Fund,NYSE,Blackrock Muniholdings Quality Fund (MUS)
1904,MUX,Mcewen Mining Inc,NYSE,Mcewen Mining Inc (MUX)
1905,MVC,Mvc Capital,NYSE,Mvc Capital (MVC)
1906,MVCB,Mvc Capital Inc.,NYSE,Mvc Capital Inc. (MVCB)
1907,MVO,Mv Oil Trust,NYSE,Mv Oil Trust (MVO)
1908,MVT,Blackrock Munivest Fund II,NYSE,Blackrock Munivest Fund II (MVT)
1909,MW,Men's Wearhouse,NYSE,Men's Wearhouse (MW)
1910,MWA,Mueller Water Products,NYSE,Mueller Water Products (MWA)
1911,MWE,Markwest Energy Partners Lp,NYSE,Markwest Energy Partners Lp (MWE)
1912,MWG,Morgan Stanley Cap TR IV Gtd Cap Secs,NYSE,Morgan Stanley Cap TR IV Gtd Cap Secs (MWG)
1913,MWO,Morgan Stanley Cap TR V Gtd Cap Secs,NYSE,Morgan Stanley Cap TR V Gtd Cap Secs (MWO)
1914,MWR,Morgan Stanley Cap TR III Capital Trust,NYSE,Morgan Stanley Cap TR III Capital Trust (MWR)
1915,MWV,Meadwestvaco Corp.,NYSE,Meadwestvaco Corp. (MWV)
1916,MWW,Monster Worldwide,NYSE,Monster Worldwide (MWW)
1917,MX,Magnachip Semiconductor Corp.,NYSE,Magnachip Semiconductor Corp. (MX)
1918,MXE,Mexico Equity And,NYSE,Mexico Equity And (MXE)
1919,MXF,Mexico Fund,NYSE,Mexico Fund (MXF)
1920,MXL,Maxlinear Inc,NYSE,Maxlinear Inc (MXL)
1921,MXT,Maxcom Telecomunicaciones Sab De Cv,NYSE,Maxcom Telecomunicaciones Sab De Cv (MXT)
1922,MY,China Ming Yang Wind Power Group Limited,NYSE,China Ming Yang Wind Power Group Limited (MY)
1923,MYC,Blackrock Muniyield California Fund,NYSE,Blackrock Muniyield California Fund (MYC)
1924,MYD,Blackrock Muniyield Fund,NYSE,Blackrock Muniyield Fund (MYD)
1925,MYE,Myers Industries,NYSE,Myers Industries (MYE)
1926,MYF,Blackrock Muniyield Investment Fund,NYSE,Blackrock Muniyield Investment Fund (MYF)
1927,MYI,Blackrock Muniyield Quality Fund III,NYSE,Blackrock Muniyield Quality Fund III (MYI)
1928,MYJ,Blackrock Muniyield New Jersey Fund,NYSE,Blackrock Muniyield New Jersey Fund (MYJ)
1929,MYM,Blackrock Muniyield Michigan Quality,NYSE,Blackrock Muniyield Michigan Quality (MYM)
1930,MYN,Blackrock Muniyield New York Quality,NYSE,Blackrock Muniyield New York Quality (MYN)
1931,MZF,Managed Duration Investment Grade Fund,NYSE,Managed Duration Investment Grade Fund (MZF)
1932,N,Netsuite Inc,NYSE,Netsuite Inc (N)
1933,NAC,Nuveen California Divadv Fund,NYSE,Nuveen California Divadv Fund (NAC)
1934,NAD,Nuveen Divadv Fund,NYSE,Nuveen Divadv Fund (NAD)
1935,NAD-C,Nuveen Div Advantage Muni Fd,NYSE,Nuveen Div Advantage Muni Fd (NAD-C)
1936,NAI,Agic International & Premium Strategy,NYSE,Agic International & Premium Strategy (NAI)
1937,NAN,Nuveen New York Divadv Fund,NYSE,Nuveen New York Divadv Fund (NAN)
1938,NAN-C,Nuveen NY Div Advantage Muni F,NYSE,Nuveen NY Div Advantage Muni F (NAN-C)
1939,NAN-D,Nuveen New York Dividend Advan,NYSE,Nuveen New York Dividend Advan (NAN-D)
1940,NAT,Nordic American Tanker Shipping Limited,NYSE,Nordic American Tanker Shipping Limited (NAT)
1941,NAV,Navistar International Corp.,NYSE,Navistar International Corp. (NAV)
1942,NAZ,Nuveen Arizona Premium Fund,NYSE,Nuveen Arizona Premium Fund (NAZ)
1943,NAZ-D,Nuveen Arizona Premium Income,NYSE,Nuveen Arizona Premium Income (NAZ-D)
1944,NBB,Nuveen Build America Bond Fund,NYSE,Nuveen Build America Bond Fund (NBB)
1945,NBD,Nuveen Build America Bond Opportunity,NYSE,Nuveen Build America Bond Opportunity (NBD)
1946,NBG,National Bank Of Greece Sa,NYSE,National Bank Of Greece Sa (NBG)
1947,NBG-A,Natl Bk Of Gr Pfd Ad,NYSE,Natl Bk Of Gr Pfd Ad (NBG-A)
1948,NBHC,National Bank Holdings Corp.,NYSE,National Bank Holdings Corp. (NBHC)
1949,NBL,Noble Energy Inc.,NYSE,Noble Energy Inc. (NBL)
1950,NBR,Nabors Industries,NYSE,Nabors Industries (NBR)
1951,NC,Nacco Industries,NYSE,Nacco Industries (NC)
1952,NCA,Nuveen California Muni Value Fund,NYSE,Nuveen California Muni Value Fund (NCA)
1953,NCI,Navigant Consulting,NYSE,Navigant Consulting (NCI)
1954,NCO,Nuveen California Muni Market,NYSE,Nuveen California Muni Market (NCO)
1955,NCP,Nuveen California Performance Plus Fund,NYSE,Nuveen California Performance Plus Fund (NCP)
1956,NCR,Ncr Corp.,NYSE,Ncr Corp. (NCR)
