,Ticker,Name,Exchange,output
2724,STK,Columbia Seligman Premium Technology,NYSE,Columbia Seligman Premium Technology (STK)
2725,STL,Sterling Bancorp,NYSE,Sterling Bancorp (STL)
2726,STL-A,Sterling Bncp TR I,NYSE,Sterling Bncp TR I (STL-A)
2727,STM,Stmicroelectronics N.V.,NYSE,Stmicroelectronics N.V. (STM)
2728,STN,Stantec Inc,NYSE,Stantec Inc (STN)
2729,STNG,Scorpio Tankers Inc.,NYSE,Scorpio Tankers Inc. (STNG)
2730,STO,Statoil Asa,NYSE,Statoil Asa (STO)
2731,STON,Stonemor Partners L.P.,NYSE,Stonemor Partners L.P. (STON)
2732,STP,Suntech Power Holdings Co.,NYSE,Suntech Power Holdings Co. (STP)
2733,STR,Questar Corp.,NYSE,Questar Corp. (STR)
2734,STRI,Str Holdings Inc,NYSE,Str Holdings Inc (STRI)
2735,STT,State Street Corp,NYSE,State Street Corp (STT)
2736,STT-C,State Street Corporation Dep Sh,NYSE,State Street Corporation Dep Sh (STT-C)
2737,STV,China Digital Tv Holding Co.,NYSE,China Digital Tv Holding Co. (STV)
2738,STWD,Starwood Property Trust,NYSE,Starwood Property Trust (STWD)
2739,STZ,Constellation Brands Inc,NYSE,Constellation Brands Inc (STZ)
2740,STZ.B,Constellation Brd B,NYSE,Constellation Brd B (STZ.B)
2741,SU,Suncor Energy Inc.,NYSE,Suncor Energy Inc. (SU)
2742,SUI,Sun Communities,NYSE,Sun Communities (SUI)
2743,SUI-A,Sun Communities Inc.,NYSE,Sun Communities Inc. (SUI-A)
2744,SUNE,Sunedison Inc.,NYSE,Sunedison Inc. (SUNE)
2745,SUP,Superior Industries International,NYSE,Superior Industries International (SUP)
2746,SUSP,Susser Petroleum Partners Lp,NYSE,Susser Petroleum Partners Lp (SUSP)
2747,SUSS,Susser Holdings Corp.,NYSE,Susser Holdings Corp. (SUSS)
2748,SVM,Silvercorp Metals Inc,NYSE,Silvercorp Metals Inc (SVM)
2749,SVU,Supervalu Inc.,NYSE,Supervalu Inc. (SVU)
2750,SWC,Stillwater Mining Company,NYSE,Stillwater Mining Company (SWC)
2751,SWFT,Swift Transportation Company,NYSE,Swift Transportation Company (SWFT)
2752,SWI,Solarwinds,NYSE,Solarwinds (SWI)
2753,SWJ,Stanley Black & Decker Inc.,NYSE,Stanley Black & Decker Inc. (SWJ)
2754,SWK,Stanley Black & Decker Inc,NYSE,Stanley Black & Decker Inc (SWK)
2755,SWM,Schweitzer-Mauduit International,NYSE,Schweitzer-Mauduit International (SWM)
2756,SWN,Southwestern Energy Company,NYSE,Southwestern Energy Company (SWN)
2757,SWS,Sws Group,NYSE,Sws Group (SWS)
2758,SWU,Stanley Black & Decker Inc,NYSE,Stanley Black & Decker Inc (SWU)
2759,SWX,Southwest Gas Corp.,NYSE,Southwest Gas Corp. (SWX)
2760,SWY,Safeway Inc.,NYSE,Safeway Inc. (SWY)
2761,SWZ,Swiss Helvetia Fund,NYSE,Swiss Helvetia Fund (SWZ)
2762,SXC,Suncoke Energy Inc,NYSE,Suncoke Energy Inc (SXC)
2763,SXCP,Suncoke Energy Partners L.P.,NYSE,Suncoke Energy Partners L.P. (SXCP)
2764,SXE,Southcross Energy Partners L.,NYSE,Southcross Energy Partners L. (SXE)
2765,SXI,Standex International Corp.,NYSE,Standex International Corp. (SXI)
2766,SXL,Sunoco Logistics Partners Lp,NYSE,Sunoco Logistics Partners Lp (SXL)
2767,SXT,Sensient Technologies Corp.,NYSE,Sensient Technologies Corp. (SXT)
2768,SYA,Symetra Financial Corp.,NYSE,Symetra Financial Corp. (SYA)
2769,SYK,Stryker Corp.,NYSE,Stryker Corp. (SYK)
2770,SYT,Syngenta Ag,NYSE,Syngenta Ag (SYT)
2771,SYX,Systemax Inc.,NYSE,Systemax Inc. (SYX)
2772,SYY,Sysco Corp.,NYSE,Sysco Corp. (SYY)
2773,SZC,The Cushing Renaissance Fund,NYSE,The Cushing Renaissance Fund (SZC)
2774,T,AT&T Inc.,NYSE,AT&T Inc. (T)
2775,TA,Travelcenters Of America Llc,NYSE,Travelcenters Of America Llc (TA)
2776,TAC,Transalta Corp.,NYSE,Transalta Corp. (TAC)
2777,TAHO,Tahoe Res Inc,NYSE,Tahoe Res Inc (TAHO)
2778,TAI,Transamerica Income Shares,NYSE,Transamerica Income Shares (TAI)
2779,TAL,Tal International Group,NYSE,Tal International Group (TAL)
2780,TAM,Taminco Corporation Common Stoc,NYSE,Taminco Corporation Common Stoc (TAM)
2781,TANN,Travelcenters Of America Llc 8.,NYSE,Travelcenters Of America Llc 8. (TANN)
2782,TAOM,Taomee Holdings Limited,NYSE,Taomee Holdings Limited (TAOM)
2783,TAP,Molson Coors Brewing Company,NYSE,Molson Coors Brewing Company (TAP)
2784,TAP.A,Molson Coors Brewing Company,NYSE,Molson Coors Brewing Company (TAP.A)
2785,TARO,Taro Pharm Inds #,NYSE,Taro Pharm Inds # (TARO)
2786,TBI,Trueblue Inc,NYSE,Trueblue Inc (TBI)
2787,TC,Thompson Creek Metals Company Inc.,NYSE,Thompson Creek Metals Company Inc. (TC)
2788,TC-T,Thompson Creek Metals Co. Inc.,NYSE,Thompson Creek Metals Co. Inc. (TC-T)
2789,TCAP,Triangle Capital Corp.,NYSE,Triangle Capital Corp. (TCAP)
2790,TCB,Tcf Financial Corp.,NYSE,Tcf Financial Corp. (TCB)
2791,TCB-B,Tcf Financial Corporation,NYSE,Tcf Financial Corporation (TCB-B)
2792,TCB-C,Tcf Financial Corp,NYSE,Tcf Financial Corp (TCB-C)
2793,TCB.W,Tcf Financial Corporation,NYSE,Tcf Financial Corporation (TCB.W)
2794,TCC,Triangle Capital Coproration,NYSE,Triangle Capital Coproration (TCC)
2795,TCCA,Triangle Capital Corporation,NYSE,Triangle Capital Corporation (TCCA)
2796,TCI,Transcontinental Realty Investors,NYSE,Transcontinental Realty Investors (TCI)
2797,TCK,Teck Resources Ltd,NYSE,Teck Resources Ltd (TCK)
2798,TCO,Taubman Centers,NYSE,Taubman Centers (TCO)
2799,TCO-J,Taubman Centers Inc. Preferred,NYSE,Taubman Centers Inc. Preferred (TCO-J)
2800,TCO-K,Taubman Centers Inc.,NYSE,Taubman Centers Inc. (TCO-K)
2801,TCP,Trident Performance Group,NYSE,Trident Performance Group (TCP)
2802,TD,Toronto Dominion Bank,NYSE,Toronto Dominion Bank (TD)
2803,TDA,Telephone And Data Systems In,NYSE,Telephone And Data Systems In (TDA)
2804,TDC,Teradata Corp.,NYSE,Teradata Corp. (TDC)
2805,TDE,Telephone And Data Systems,NYSE,Telephone And Data Systems (TDE)
2806,TDF,Templeton Dragon Fund,NYSE,Templeton Dragon Fund (TDF)
2807,TDG,Transdigm Group Inc.,NYSE,Transdigm Group Inc. (TDG)
2808,TDI,Telephone And Data Systems,NYSE,Telephone And Data Systems (TDI)
2809,TDJ,Telephone And Data Systems In,NYSE,Telephone And Data Systems In (TDJ)
2810,TDS,Telephone And Data Systems,NYSE,Telephone And Data Systems (TDS)
2811,TDW,Tidewater Inc.,NYSE,Tidewater Inc. (TDW)
2812,TDY,Teledyne Technologies Inc.,NYSE,Teledyne Technologies Inc. (TDY)
2813,TE,Teco Energy,NYSE,Teco Energy (TE)
2814,TEF,Telefonica Sa,NYSE,Telefonica Sa (TEF)
2815,TEG,Integrys Energy Group,NYSE,Integrys Energy Group (TEG)
2816,TEI,Templeton Emerging Markets,NYSE,Templeton Emerging Markets (TEI)
2817,TEL,Te Connectivity Ltd,NYSE,Te Connectivity Ltd (TEL)
2818,TEN,Tenneco Automotive,NYSE,Tenneco Automotive (TEN)
2819,TEO,Telecom Argentina Stet - France Telecom,NYSE,Telecom Argentina Stet - France Telecom (TEO)
2820,TEP,Tallgrass Energy Partners Lp,NYSE,Tallgrass Energy Partners Lp (TEP)
2821,TER,Teradyne,NYSE,Teradyne (TER)
2822,TEU,Box Ships Inc.,NYSE,Box Ships Inc. (TEU)
2823,TEU-C,Box Ships Inc.,NYSE,Box Ships Inc. (TEU-C)
2824,TEVA,Teva Pharmaceutical Industries Limited,NYSE,Teva Pharmaceutical Industries Limited (TEVA)
2825,TEX,Terex Corp.,NYSE,Terex Corp. (TEX)
2826,TFG,Fixed Income Trust For Goldman,NYSE,Fixed Income Trust For Goldman (TFG)
2827,TFX,Teleflex Inc.,NYSE,Teleflex Inc. (TFX)
2828,TG,Tredegar Corp.,NYSE,Tredegar Corp. (TG)
2829,TGH,Textainer Group Holdings,NYSE,Textainer Group Holdings (TGH)
2830,TGI,Triumph Group,NYSE,Triumph Group (TGI)
2831,TGP,Teekay Lng Partners L.P.,NYSE,Teekay Lng Partners L.P. (TGP)
2832,TGS,Transportadora De Gas Sa Ord B,NYSE,Transportadora De Gas Sa Ord B (TGS)
2833,TGT,Target Corp.,NYSE,Target Corp. (TGT)
2834,TGX,Theragenics Corp.,NYSE,Theragenics Corp. (TGX)
2835,THC,Tenet Healthcare Corp.,NYSE,Tenet Healthcare Corp. (THC)
2836,THG,The Hanover Insurance Group,NYSE,The Hanover Insurance Group (THG)
2837,THGA,The Hanover Insurance Group I,NYSE,The Hanover Insurance Group I (THGA)
2838,THI,Tim Hortons Inc.,NYSE,Tim Hortons Inc. (THI)
2839,THO,Thor Industries,NYSE,Thor Industries (THO)
2840,THR,Thermon Group Holdings Inc.,NYSE,Thermon Group Holdings Inc. (THR)
2841,THS,Treehouse Foods,NYSE,Treehouse Foods (THS)
2842,TI,Telecom Italia S.P.A.,NYSE,Telecom Italia S.P.A. (TI)
2843,TI.A,Telecom Italia S.P.A.,NYSE,Telecom Italia S.P.A. (TI.A)
2844,TIF,Tiffany & Co.,NYSE,Tiffany & Co. (TIF)
2845,TISI,Team,NYSE,Team (TISI)
2846,TJX,Tjx Companies,NYSE,Tjx Companies (TJX)
2847,TK,Teekay Shipping Corp.,NYSE,Teekay Shipping Corp. (TK)
2848,TKC,Turkcell Iletisim Hizmetleri As,NYSE,Turkcell Iletisim Hizmetleri As (TKC)
2849,TKF,Turkish Investment Fund,NYSE,Turkish Investment Fund (TKF)
2850,TKR,Timken Company,NYSE,Timken Company (TKR)
2851,TLI,Lmp Corporate Loan Fund Inc,NYSE,Lmp Corporate Loan Fund Inc (TLI)
2852,TLK,P.T. Telekomunikasi Indonesia Tbk.,NYSE,P.T. Telekomunikasi Indonesia Tbk. (TLK)
2853,TLLP,Tesoro Logistics Lp Common Unit,NYSE,Tesoro Logistics Lp Common Unit (TLLP)
2854,TLM,Talisman Energy Inc.,NYSE,Talisman Energy Inc. (TLM)
2855,TLP,Transmontaigne Partners L.P.,NYSE,Transmontaigne Partners L.P. (TLP)
2856,TLYS,Tilly's Inc.,NYSE,Tilly's Inc. (TLYS)
2857,TM,Toyota Motor Corp Ltd Ord,NYSE,Toyota Motor Corp Ltd Ord (TM)
2858,TMH,Team Health Holdings,NYSE,Team Health Holdings (TMH)
2859,TMHC,Taylor Morrison Home Corporatio,NYSE,Taylor Morrison Home Corporatio (TMHC)
2860,TMK,Torchmark Corp.,NYSE,Torchmark Corp. (TMK)
2861,TMK-B,Torchmark Corporation,NYSE,Torchmark Corporation (TMK-B)
2862,TMO,Thermo Fisher Scientific Inc,NYSE,Thermo Fisher Scientific Inc (TMO)
2863,TMS,Tms International Corp.,NYSE,Tms International Corp. (TMS)
2864,TMUS,T-Mobile US Inc.,NYSE,T-Mobile US Inc. (TMUS)
2865,TNC,Tennant Company,NYSE,Tennant Company (TNC)
2866,TNH,Terra Nitrogen Company L.P.,NYSE,Terra Nitrogen Company L.P. (TNH)
2867,TNK,Teekay Tankers Ltd,NYSE,Teekay Tankers Ltd (TNK)
2868,TNP,Tsakos Energy Navigation Ltd,NYSE,Tsakos Energy Navigation Ltd (TNP)
2869,TNP-B,Tsakos Energy Navigation Limit,NYSE,Tsakos Energy Navigation Limit (TNP-B)
2870,TOL,Toll Brothers Inc.,NYSE,Toll Brothers Inc. (TOL)
2871,TOO,Teekay Offshore Partners L.P.,NYSE,Teekay Offshore Partners L.P. (TOO)
2872,TOO-A,Teekay Offshore Partners L.P.,NYSE,Teekay Offshore Partners L.P. (TOO-A)
2873,TOT,Totalfinaelf S.A.,NYSE,Totalfinaelf S.A. (TOT)
2874,TOWR,Tower International,NYSE,Tower International (TOWR)
2875,TPC,Tutor Perini Corp.,NYSE,Tutor Perini Corp. (TPC)
2876,TPGI,Thomas Properties Group,NYSE,Thomas Properties Group (TPGI)
2877,TPH,Tri Pointe Homes Inc. Common S,NYSE,Tri Pointe Homes Inc. Common S (TPH)
2878,TPL,Texas Pacific Land Trust,NYSE,Texas Pacific Land Trust (TPL)
2879,TPRE,Third Point Reinsurance Ltd. Co,NYSE,Third Point Reinsurance Ltd. Co (TPRE)
2880,TPX,Tempur-Pedic International Inc,NYSE,Tempur-Pedic International Inc (TPX)
2881,TPZ,Tortoise Power And Energy,NYSE,Tortoise Power And Energy (TPZ)
2882,TR,Tootsie Roll Industries,NYSE,Tootsie Roll Industries (TR)
2883,TRC,Tejon Ranch Company,NYSE,Tejon Ranch Company (TRC)
2884,TREX,Trex Company,NYSE,Trex Company (TREX)
2885,TRF,Templeton Russia Fund,NYSE,Templeton Russia Fund (TRF)
2886,TRGP,Targa Resources,NYSE,Targa Resources (TRGP)
2887,TRI,Thomson Reuters Corp,NYSE,Thomson Reuters Corp (TRI)
2888,TRK,Speedway Motorsports,NYSE,Speedway Motorsports (TRK)
2889,TRLA,Trulia Inc.,NYSE,Trulia Inc. (TRLA)
2890,TRMR,Tremor Video Inc.,NYSE,Tremor Video Inc. (TRMR)
2891,TRN,Trinity Industries,NYSE,Trinity Industries (TRN)
2892,TRN-A,Terreno Realty Corporation Pref,NYSE,Terreno Realty Corporation Pref (TRN-A)
2893,TRNO,Terreno Realty Corp.,NYSE,Terreno Realty Corp. (TRNO)
2894,TROX,Tronox Inc,NYSE,Tronox Inc (TROX)
2895,TRP,Transcananda Pipelines,NYSE,Transcananda Pipelines (TRP)
2896,TRQ,Turquoise Hill Resources Ltd.,NYSE,Turquoise Hill Resources Ltd. (TRQ)
2897,TRR,Trc Companies,NYSE,Trc Companies (TRR)
2898,TRV,The Travelers Companies Inc,NYSE,The Travelers Companies Inc (TRV)
2899,TRW,Trw Automotive Holdings Corp.,NYSE,Trw Automotive Holdings Corp. (TRW)
2900,TS,Tenaris S.A.,NYSE,Tenaris S.A. (TS)
2901,TSI,Tcw Strategic,NYSE,Tcw Strategic (TSI)
2902,TSL,Trina Solar Limited,NYSE,Trina Solar Limited (TSL)
2903,TSM,Taiwan Semiconductor Manufacturing,NYSE,Taiwan Semiconductor Manufacturing (TSM)
2904,TSN,Tyson Foods,NYSE,Tyson Foods (TSN)
2905,TSO,Tesoro Petroleum Corp.,NYSE,Tesoro Petroleum Corp. (TSO)
2906,TSS,Total System Services,NYSE,Total System Services (TSS)
2907,TSU,Tim Participacoes S.A.,NYSE,Tim Participacoes S.A. (TSU)
2908,TTC,Toro Company,NYSE,Toro Company (TTC)
2909,TTF,Thai Fund,NYSE,Thai Fund (TTF)
2910,TTI,Tetra Technologies,NYSE,Tetra Technologies (TTI)
2911,TTM,Tata Motors Ltd,NYSE,Tata Motors Ltd (TTM)
2912,TTP,Tortoise Pipeline & Energy Fund,NYSE,Tortoise Pipeline & Energy Fund (TTP)
2913,TU,Telus Corp. Non Voting Shares,NYSE,Telus Corp. Non Voting Shares (TU)
2914,TUC,Mac-Gray Corp.,NYSE,Mac-Gray Corp. (TUC)
2915,TUMI,Tumi Holdings Inc.,NYSE,Tumi Holdings Inc. (TUMI)
2916,TUP,Tupperware Corp.,NYSE,Tupperware Corp. (TUP)
2917,TV,Grupo Televisa S.A.,NYSE,Grupo Televisa S.A. (TV)
2918,TVC,Tennessee Valley Authority,NYSE,Tennessee Valley Authority (TVC)
2919,TVE,Tennessee Valley Authority,NYSE,Tennessee Valley Authority (TVE)
2920,TVL,Lin Tv Corp,NYSE,Lin Tv Corp (TVL)
2921,TW,Towers Watson & Co,NYSE,Towers Watson & Co (TW)
2922,TWC,Time Warner Cable Inc,NYSE,Time Warner Cable Inc (TWC)
2923,TWI,Titan International,NYSE,Titan International (TWI)
2924,TWN,Taiwan Fund,NYSE,Taiwan Fund (TWN)
2925,TWO,Two Harbors Investments Corp,NYSE,Two Harbors Investments Corp (TWO)
2926,TWX,Time Warner Inc.,NYSE,Time Warner Inc. (TWX)
2927,TX,Ternium S.A.,NYSE,Ternium S.A. (TX)
2928,TXI,Texas Industries,NYSE,Texas Industries (TXI)
2929,TXT,Textron Inc.,NYSE,Textron Inc. (TXT)
2930,TXTR,Textura Corporation,NYSE,Textura Corporation (TXTR)
2931,TY,Tri Continental Corp.,NYSE,Tri Continental Corp. (TY)
2932,TY.P,Tri Contl Cp 2.50 Pr,NYSE,Tri Contl Cp 2.50 Pr (TY.P)
2933,TYC,Tyco International Ltd.,NYSE,Tyco International Ltd. (TYC)
2934,TYG,Tortoise Energy Infrastructure Corp.,NYSE,Tortoise Energy Infrastructure Corp. (TYG)
2935,TYG-B,Tortoise Energy Infrastructure,NYSE,Tortoise Energy Infrastructure (TYG-B)
2936,TYL,Tyler Technologies,NYSE,Tyler Technologies (TYL)
2937,TYN,Tortoise North American Energy Corp.,NYSE,Tortoise North American Energy Corp. (TYN)
2938,TYY,Tortoise Energy Capital Corp.,NYSE,Tortoise Energy Capital Corp. (TYY)
2939,TYY-C,Tortoise Energy Capital Copror,NYSE,Tortoise Energy Capital Copror (TYY-C)
2940,TZF,Bear Stearns Depositor,NYSE,Bear Stearns Depositor (TZF)
2941,UA,Under Armour,NYSE,Under Armour (UA)
2942,UAL,United Continental Holdings,NYSE,United Continental Holdings (UAL)
2943,UAM,Universal American Financial,NYSE,Universal American Financial (UAM)
2944,UAN,Cvr Partners Lp Common Units R,NYSE,Cvr Partners Lp Common Units R (UAN)
2945,UBA,Urstadt Biddle Properties Inc.,NYSE,Urstadt Biddle Properties Inc. (UBA)
2946,UBP,Urstadt Biddle Properties Inc.,NYSE,Urstadt Biddle Properties Inc. (UBP)
2947,UBP-D,Urstadt Biddle Prf D,NYSE,Urstadt Biddle Prf D (UBP-D)
2948,UBP-F,Privatebancorp Inc.,NYSE,Privatebancorp Inc. (UBP-F)
2949,UBS,UBS Ag,NYSE,UBS Ag (UBS)
2950,UBS-D,UBS Pfd Fndg TR IV,NYSE,UBS Pfd Fndg TR IV (UBS-D)
2951,UCP,Ucp Inc.,NYSE,Ucp Inc. (UCP)
2952,UDR,United Dominion Realty Trust,NYSE,United Dominion Realty Trust (UDR)
2953,UFI,Unifi,NYSE,Unifi (UFI)
2954,UFS,Domtar Corp.,NYSE,Domtar Corp. (UFS)
2955,UGI,Ugi Corp.,NYSE,Ugi Corp. (UGI)
2956,UGP,Ultrapar Participacoes S.A.,NYSE,Ultrapar Participacoes S.A. (UGP)
2957,UHS,Universal Health Services,NYSE,Universal Health Services (UHS)
2958,UHT,Universal Health Realty Income Trust,NYSE,Universal Health Realty Income Trust (UHT)
2959,UIL,Uil Holdings Corp.,NYSE,Uil Holdings Corp. (UIL)
2960,UIS,Unisys Corp.,NYSE,Unisys Corp. (UIS)
2961,UIS-A,Unisys Corporation Series A Con,NYSE,Unisys Corporation Series A Con (UIS-A)
2962,UL,Unilever Plc,NYSE,Unilever Plc (UL)
2963,UMC,United Microelectronics Corp.,NYSE,United Microelectronics Corp. (UMC)
2964,UMH,Umh Properties,NYSE,Umh Properties (UMH)
2965,UMH-A,Umh Properties Inc. 8.25% Seri,NYSE,Umh Properties Inc. 8.25% Seri (UMH-A)
2966,UN,Unilever Nv,NYSE,Unilever Nv (UN)
2967,UNF,Unifirst Corp.,NYSE,Unifirst Corp. (UNF)
2968,UNH,Unitedhealth Group Inc.,NYSE,Unitedhealth Group Inc. (UNH)
2969,UNM,Unumprovident Corp.,NYSE,Unumprovident Corp. (UNM)
2970,UNP,Union Pacific Corp.,NYSE,Union Pacific Corp. (UNP)
2971,UNS,Unisource Energy Corp.,NYSE,Unisource Energy Corp. (UNS)
2972,UNT,Unit Corp.,NYSE,Unit Corp. (UNT)
2973,UPL,Ultra Petroleum,NYSE,Ultra Petroleum (UPL)
2974,UPS,United Parcel Service,NYSE,United Parcel Service (UPS)
2975,URI,United Rentals,NYSE,United Rentals (URI)
2976,URS,Urs Corp.,NYSE,Urs Corp. (URS)
2977,USA,Liberty All-Star Equity Fund,NYSE,Liberty All-Star Equity Fund (USA)
2978,USAC,USA Compression Partners Lp,NYSE,USA Compression Partners Lp (USAC)
2979,USB,U.S. Bancorp,NYSE,U.S. Bancorp (USB)
2980,USB-A,U.S. Bancorp Depositary Shares,NYSE,U.S. Bancorp Depositary Shares (USB-A)
2981,USB-H,US Bancorp Dep Sh,NYSE,US Bancorp Dep Sh (USB-H)
2982,USB-M,U.S. Bancorp,NYSE,U.S. Bancorp (USB-M)
2983,USB-N,U.S. Bancorp,NYSE,U.S. Bancorp (USB-N)
2984,USB-O,U.S. Bancorp,NYSE,U.S. Bancorp (USB-O)
2985,USG,Usg Corp.,NYSE,Usg Corp. (USG)
2986,USM,United States Cellular Corp.,NYSE,United States Cellular Corp. (USM)
2987,USNA,Usana Health Sciences Inc.,NYSE,Usana Health Sciences Inc. (USNA)
2988,USPH,U.S. Physical Therapy,NYSE,U.S. Physical Therapy (USPH)
2989,USU,Usec Inc.,NYSE,Usec Inc. (USU)
2990,UTF,Cohen & Steers Infrastructure Fund,NYSE,Cohen & Steers Infrastructure Fund (UTF)
2991,UTI,Universal Technical Institute Inc,NYSE,Universal Technical Institute Inc (UTI)
2992,UTL,Unitil Corp.,NYSE,Unitil Corp. (UTL)
2993,UTX,United Technologies Corp.,NYSE,United Technologies Corp. (UTX)
2994,UTX-A,United Technologies Corporatio,NYSE,United Technologies Corporatio (UTX-A)
2995,UVV,Universal Corp.,NYSE,Universal Corp. (UVV)
2996,UZA,United States Cellular Corp.,NYSE,United States Cellular Corp. (UZA)
2997,V,Visa Inc.,NYSE,Visa Inc. (V)
2998,VAC,Marriot Vacations Worldwide Cor,NYSE,Marriot Vacations Worldwide Cor (VAC)
2999,VAL,Valspar Corp.,NYSE,Valspar Corp. (VAL)
3000,VAL.P,Vale S.A.,NYSE,Vale S.A. (VAL.P)
3001,VALE,Vale S.A.,NYSE,Vale S.A. (VALE)
3002,VAR,Varian Medical Systems,NYSE,Varian Medical Systems (VAR)
3003,VBF,Invesco Van Kampen Bond Fund,NYSE,Invesco Van Kampen Bond Fund (VBF)
3004,VC,Visteon Corp.,NYSE,Visteon Corp. (VC)
3005,VCI,Valassis Communications,NYSE,Valassis Communications (VCI)
3006,VCO,Vina Concha Y Toro,NYSE,Vina Concha Y Toro (VCO)
3007,VCRA,Vocera Communications Inc.,NYSE,Vocera Communications Inc. (VCRA)
3008,WAB,Wabtec Corp.,NYSE,Wabtec Corp. (WAB)
3009,WAC,Walter Investment Management Corp.,NYSE,Walter Investment Management Corp. (WAC)
3010,WAG,Walgreen Company,NYSE,Walgreen Company (WAG)
3011,WAGE,Wageworks Inc.,NYSE,Wageworks Inc. (WAGE)
3012,WAIR,Wesco Aircraft Holdings Inc.,NYSE,Wesco Aircraft Holdings Inc. (WAIR)
3013,WAL,Western Alliance Bancorporation,NYSE,Western Alliance Bancorporation (WAL)
3014,WAT,Waters Corp.,NYSE,Waters Corp. (WAT)
3015,WBC,Wabco Holdings Inc.,NYSE,Wabco Holdings Inc. (WBC)
3016,WBK,Westpac Banking Corp.,NYSE,Westpac Banking Corp. (WBK)
3017,WBS,Webster Financial Corp.,NYSE,Webster Financial Corp. (WBS)
3018,X,United States Steel Corp.,NYSE,United States Steel Corp. (X)
3019,XAA,American Muni Income Portfolio,NYSE,American Muni Income Portfolio (XAA)
3020,XCO,Exco Resources Nl,NYSE,Exco Resources Nl (XCO)
3021,XEC,Cimarex Energy Co,NYSE,Cimarex Energy Co (XEC)
3022,XEL,Xcel Energy Inc.,NYSE,Xcel Energy Inc. (XEL)
3023,XFP,Lehman Abs Corp.,NYSE,Lehman Abs Corp. (XFP)
3024,XFR,Lehman Abs Corp.,NYSE,Lehman Abs Corp. (XFR)
3025,XIN,Xinyuan Real Estate Co Ltd,NYSE,Xinyuan Real Estate Co Ltd (XIN)
3026,XKE,Lehman Abs Corp.,NYSE,Lehman Abs Corp. (XKE)
3027,XKO,Lehman Abs Corp.,NYSE,Lehman Abs Corp. (XKO)
3028,XL,Xl Company Switzerland Gmbh,NYSE,Xl Company Switzerland Gmbh (XL)
3029,XLS,Exelis Inc. Common Stock New Wh,NYSE,Exelis Inc. Common Stock New Wh (XLS)
3030,XNY,China Xiniya Fashion,NYSE,China Xiniya Fashion (XNY)
3031,XOM,Exxon Mobil Corp.,NYSE,Exxon Mobil Corp. (XOM)
3032,XON,Intrexon Corp,NYSE,Intrexon Corp (XON)
3033,XOXO,Xoxo Group Inc,NYSE,Xoxo Group Inc (XOXO)
3034,XPO,Express-1 Expedited Solutions,NYSE,Express-1 Expedited Solutions (XPO)
3035,XRM,Xerium Technologies,NYSE,Xerium Technologies (XRM)
3036,XRS,Tal Education Group,NYSE,Tal Education Group (XRS)
3037,XRX,Xerox Corp.,NYSE,Xerox Corp. (XRX)
3038,XUE,Xueda Education Group,NYSE,Xueda Education Group (XUE)
3039,XVG,Lehman Abs Corp.,NYSE,Lehman Abs Corp. (XVG)
3040,XYL,Xylem Inc. Common Stock New Whe,NYSE,Xylem Inc. Common Stock New Whe (XYL)
3041,Y,Alleghany Corp.,NYSE,Alleghany Corp. (Y)
3042,YELP,Yelp Inc.,NYSE,Yelp Inc. (YELP)
3043,YGE,Yingli Green Energy Holding Company,NYSE,Yingli Green Energy Holding Company (YGE)
3044,YOKU,Youku.Com Inc.,NYSE,Youku.Com Inc. (YOKU)
3045,YPF,Ypf Sociedad Anonima,NYSE,Ypf Sociedad Anonima (YPF)
3046,YUM,Yum! Brands,NYSE,Yum! Brands (YUM)
3047,YUME,Yume Inc.,NYSE,Yume Inc. (YUME)
3048,YZC,Yanzhou Coal Mining Company,NYSE,Yanzhou Coal Mining Company (YZC)
3049,ZA,Zuoan Fashion Limited American,NYSE,Zuoan Fashion Limited American (ZA)
3050,ZB-A,Zions Bc Dp Shs A,NYSE,Zions Bc Dp Shs A (ZB-A)
3051,ZB-C,Zions Bancorporation,NYSE,Zions Bancorporation (ZB-C)
3052,ZB-F,Zions Bancorporation,NYSE,Zions Bancorporation (ZB-F)
3053,ZB-G,Zions Bancorporation,NYSE,Zions Bancorporation (ZB-G)
3054,ZB-H,Zions Bancorporation,NYSE,Zions Bancorporation (ZB-H)
3055,ZEP,Zep Inc.,NYSE,Zep Inc. (ZEP)
3056,ZF,Zweig Fund,NYSE,Zweig Fund (ZF)
3057,ZFC,Zais Financial Corp. Common Sto,NYSE,Zais Financial Corp. Common Sto (ZFC)
3058,ZLC,Zale Corporation,NYSE,Zale Corporation (ZLC)
3059,ZMH,Zimmer Holdings,NYSE,Zimmer Holdings (ZMH)
3060,ZNH,China Southern Airlines Company,NYSE,China Southern Airlines Company (ZNH)
3061,ZQK,Quiksilver,NYSE,Quiksilver (ZQK)
3062,ZTR,Zweig Total Return Fund,NYSE,Zweig Total Return Fund (ZTR)
3063,ZTS,Zoetis Inc. Class A Common Stoc,NYSE,Zoetis Inc. Class A Common Stoc (ZTS)
3064,ZX,China Zenix Auto International,NYSE,China Zenix Auto International (ZX)
3065,AAIT,AC Asia Information Tech MSCI Ishares,NASDAQ,AC Asia Information Tech MSCI Ishares (AAIT)
3066,AAME,Atlantic American Corp.,NASDAQ,Atlantic American Corp. (AAME)
3067,AAON,Aaon,NASDAQ,Aaon (AAON)
3068,AAPL,Apple Inc.,NASDAQ,Apple Inc. (AAPL)
3069,AAWW,Atlas Air Worldwide Holdings,NASDAQ,Atlas Air Worldwide Holdings (AAWW)
3070,AAXJ,All Country Asia Ex Jpn Idx MSCI Ishares,NASDAQ,All Country Asia Ex Jpn Idx MSCI Ishares (AAXJ)
3071,ABAX,Abaxis,NASDAQ,Abaxis (ABAX)
3072,ABCB,Ameris Bancorp,NASDAQ,Ameris Bancorp (ABCB)
3073,ABCD,Cambium Learning Group,NASDAQ,Cambium Learning Group (ABCD)
3074,ABCO,The Advisory Board Company,NASDAQ,The Advisory Board Company (ABCO)
3075,ABFS,Arkansas Best Corp.,NASDAQ,Arkansas Best Corp. (ABFS)
3076,ABIO,Arca Biopharma,NASDAQ,Arca Biopharma (ABIO)
3077,ABMD,Abiomed,NASDAQ,Abiomed (ABMD)
3078,ABTL,Autobytel Inc.,NASDAQ,Autobytel Inc. (ABTL)
3079,ACAD,Acadia Pharmaceuticals Inc.,NASDAQ,Acadia Pharmaceuticals Inc. (ACAD)
3080,ACAS,American Capital,NASDAQ,American Capital (ACAS)
3081,ACAT,Arctic Cat Inc.,NASDAQ,Arctic Cat Inc. (ACAT)
3082,ACCL,Accelrys,NASDAQ,Accelrys (ACCL)
3083,ACET,Aceto Corp.,NASDAQ,Aceto Corp. (ACET)
3084,ACFC,Atlantic Coast Federal Corp.,NASDAQ,Atlantic Coast Federal Corp. (ACFC)
3085,ACFN,Acorn Energy,NASDAQ,Acorn Energy (ACFN)
3086,ACGL,Arch Capital Group Ltd,NASDAQ,Arch Capital Group Ltd (ACGL)
3087,ACHC,Acadia Healthcare Company Inc.,NASDAQ,Acadia Healthcare Company Inc. (ACHC)
3088,ACHN,Achillion Pharmaceuticals,NASDAQ,Achillion Pharmaceuticals (ACHN)
3089,ACIW,Aci Worldwide,NASDAQ,Aci Worldwide (ACIW)
3090,ACLS,Axcelis Technologies,NASDAQ,Axcelis Technologies (ACLS)
3091,ACNB,Acnb Corp.,NASDAQ,Acnb Corp. (ACNB)
3092,ACOR,Acorda Therapeutics,NASDAQ,Acorda Therapeutics (ACOR)
3093,ACPW,Active Power,NASDAQ,Active Power (ACPW)
3094,ACRX,Acelrx Pharmaceuticals,NASDAQ,Acelrx Pharmaceuticals (ACRX)
3095,ACST,Acasti Pharma Inc,NASDAQ,Acasti Pharma Inc (ACST)
3096,ACTG,Acacia Research Corp.,NASDAQ,Acacia Research Corp. (ACTG)
3097,ACTS,Actions Semiconductor Co.,NASDAQ,Actions Semiconductor Co. (ACTS)
3098,ACUR,Acura Pharmaceuticals,NASDAQ,Acura Pharmaceuticals (ACUR)
3099,ACWI,ACWI Index MSCI Ishares,NASDAQ,ACWI Index MSCI Ishares (ACWI)
3100,ACWX,ACWI Ex-US Index MSCI Ishares,NASDAQ,ACWI Ex-US Index MSCI Ishares (ACWX)
3101,ACXM,Acxiom Corp.,NASDAQ,Acxiom Corp. (ACXM)
3102,ADAT,Authentidate Holding,NASDAQ,Authentidate Holding (ADAT)
3103,ADBE,Adobe Systems Incorporated,NASDAQ,Adobe Systems Incorporated (ADBE)
3104,ADEP,Adept Technology,NASDAQ,Adept Technology (ADEP)
3105,ADES,Ada-Es,NASDAQ,Ada-Es (ADES)
3106,ADHD,Alcobra Ltd.,NASDAQ,Alcobra Ltd. (ADHD)
3107,ADI,Analog Devices,NASDAQ,Analog Devices (ADI)
3108,ADNC,Audience Inc.,NASDAQ,Audience Inc. (ADNC)
3109,ADP,Automatic Data Processing,NASDAQ,Automatic Data Processing (ADP)
3110,ADRA,Asia 50 ADR Index Bldrs,NASDAQ,Asia 50 ADR Index Bldrs (ADRA)
3111,ADRD,Dev Mkts 100 ADR Index Bldrs,NASDAQ,Dev Mkts 100 ADR Index Bldrs (ADRD)
3112,ADRE,Emrg Mkts 50 ADR Index Bldrs,NASDAQ,Emrg Mkts 50 ADR Index Bldrs (ADRE)
3113,ADRU,Europe 100 ADR Index Bldrs,NASDAQ,Europe 100 ADR Index Bldrs (ADRU)
3114,ADSK,Autodesk,NASDAQ,Autodesk (ADSK)
3115,ADTN,Adtran,NASDAQ,Adtran (ADTN)
3116,ADUS,Addus Homecare Corp.,NASDAQ,Addus Homecare Corp. (ADUS)
3117,ADVS,Advent Software,NASDAQ,Advent Software (ADVS)
3118,AEGN,Aegoin Corp,NASDAQ,Aegoin Corp (AEGN)
3119,AEGR,Aegerion Pharmaceuticals,NASDAQ,Aegerion Pharmaceuticals (AEGR)
3120,AEHR,Aehr Test Systems,NASDAQ,Aehr Test Systems (AEHR)
3121,AEIS,Advanced Energy Industries,NASDAQ,Advanced Energy Industries (AEIS)
3122,AEPI,Aep Industries Inc.,NASDAQ,Aep Industries Inc. (AEPI)
3123,AERL,Asia Entertainment & Resources Ltd,NASDAQ,Asia Entertainment & Resources Ltd (AERL)
3124,AETI,American Electric Technologies,NASDAQ,American Electric Technologies (AETI)
3125,AEY,Addvantage Technologies Group,NASDAQ,Addvantage Technologies Group (AEY)
3126,AEZS,Aeterna Zentaris,NASDAQ,Aeterna Zentaris (AEZS)
3127,AFAM,Almost Family Inc,NASDAQ,Almost Family Inc (AFAM)
